{"$schema":"https://json-schema.org/draft/2020-12/schema","title":"Research Taxonomy","type":"object","required":["domains","disciplines","technologies","audiences","contentTypes","sourceTypes"],"properties":{"domains":{"type":"array","items":{"type":"string","pattern":"^[a-z0-9-]+$"},"uniqueItems":true},"disciplines":{"type":"array","items":{"type":"string","pattern":"^[a-z0-9-]+$"},"uniqueItems":true},"technologies":{"type":"array","items":{"type":"string","pattern":"^[a-z0-9-]+$"},"uniqueItems":true},"audiences":{"type":"array","items":{"type":"string","pattern":"^[a-z0-9-]+$"},"uniqueItems":true},"contentTypes":{"type":"array","items":{"type":"string","pattern":"^[a-z0-9-]+$"},"uniqueItems":true},"sourceTypes":{"type":"array","items":{"type":"string","enum":["official-docs","github","reddit","x","research","standards","community","release"]},"uniqueItems":true}}}