{"domains":["games","software","web","apps","design"],"disciplines":["development","design","ux","art","audio","qa","devops","production","narrative"],"technologies":["ai","agents","mcp","vibe-coding","react","unity","godot","roblox","webgl","swift","kotlin"],"audiences":["beginner","indie","professional","designer","developer","studio"],"contentTypes":["research","guide","tutorial","benchmark","comparison","case-study","opinion","trend","news","standard","glossary"],"sourceTypes":["official-docs","github","reddit","x","research","standards","community","release"]}